{
  "schemaVersion": "0.3",
  "flowId": "FLOW_USER_CRUD",
  "name": "사용자 CRUD 흐름",
  "description": "사용자 등록, 조회, 수정, 삭제 흐름",
  "startPageStateId": "PAGE_001",
  "transitions": [
    {
      "transitionId": "TR_001",
      "fromPageStateId": "PAGE_001",
      "toPageStateId": "PAGE_002",
      "trigger": {
        "action": "click",
        "elementId": "PAGE_001.el_0001",
        "description": "등록 버튼 클릭"
      },
      "expectedNavigation": {
        "type": "URL_CHANGE",
        "urlPattern": "/users/new",
        "requiredTexts": ["사용자 등록", "저장"],
        "timeoutMs": 5000
      }
    },
    {
      "transitionId": "TR_002",
      "fromPageStateId": "PAGE_002",
      "toPageStateId": "PAGE_001",
      "trigger": {
        "action": "click",
        "elementId": "PAGE_002.el_0020",
        "description": "저장 버튼 클릭"
      },
      "expectedNavigation": {
        "type": "URL_CHANGE_OR_TEXT_APPEAR",
        "urlPattern": "/users",
        "requiredTexts": ["저장되었습니다"],
        "timeoutMs": 5000
      }
    }
  ]
}
